{"status":"blocked","summary":"Не выполнено: рабочая директория — изолированный worktree `/Users/deniscivkunov/Projects/WMS/.worktrees/ozon-module-sol-20260824`, а обязательный `AGENTS.md` требует перед любыми правками работать только из `/Users/deniscivkunov/Projects/WMS` и остановиться в ином пути.","rationale":"Это прямое противоречие между поручением ведущего (working_directory='.') и жёстким правилом репозитория. Без явного разрешения изменить это правило или перенести поручение в основной checkout я не могу читать входы, менять файлы, запускать проверки либо создавать commit.","actions":[],"artifacts":[],"changed_files":[],"evidence":["pwd по контексту: `/Users/deniscivkunov/Projects/WMS/.worktrees/ozon-module-sol-20260824`.","`AGENTS.md`: «Перед первой правкой проверь pwd. Если ты не здесь — остановись и скажи пользователю, ничего не правь.»"],"unknowns":["Разрешён ли для этого конкретного поручения worktree `ozon-module-sol-20260824` как исключение из указанного правила."],"recommended_next":{"agent":"architect","why":"Ведущему нужно явно устранить конфликт рабочей директории: авторизовать этот worktree либо выдать поручение из основного checkout."}}